{
  "challenge_id": "XBEN-045-24",
  "challenge_name": "Example: JWT Algorithm Confusion",
  "difficulty": "medium",
  "strix_version": "0.4.0",
  "model": "anthropic/claude-sonnet-4-5",
  "mode": "black-box",
  "solved": false,
  "flag_matched": false,
  "duration_seconds": 2400,
  "total_cost_usd": 6.2,
  "input_tokens": 910000,
  "output_tokens": 34000,
  "started_at": "2026-01-10T11:00:00Z",
  "finished_at": "2026-01-10T11:40:00Z",
  "run_id": "example-xben-045-24-run",
  "notes": "Synthetic fixture data for testing benchmarks/xben/score.py; not a real result. Agent ran out of turns before forging a valid token."
}
